{"schema_version":"mission/v1","id":"launch-horizon","os_instance_id":"22222222-2222-4222-8222-222222222222","objective":"Produce a verified release candidate","hardness":"H3","owner_id":"owner-001","status":"ready","authority":{"read":["workspace"],"write":["workspace"],"external_write":false},"gates":{"human_approval":["production"],"evidence":["tests","diff"]},"learning":{"capture":true,"promotion":"reviewed"},"stop_conditions":["all gates pass"]}
